<?xml version="1.0" encoding="UTF-8"?>
<schema xmlns="https://www.adambaker.org/mortal-engine/tests"
	xmlns:xsi="http://www.w3.org/2001/XMLSchema-instance" 
	xsi:schemaLocation="https://www.adambaker.org/mortal-engine/tests ../schemata/tests.xsd"
	label="Copies 1">
    <morphology-file>21-Copies-1.xml</morphology-file>
    <message>Same as 09-Multiple-Models.xml</message>
    <accept lang="wk-LA">bilTense</accept>
    <reject lang="wk-LA">bilCase</reject>
    <reject lang="wk-LA">ataTense</reject>
    <accept lang="wk-LA">ataCase</accept>
    <message>Plurals on nouns</message>
    <accept lang="wk-LA">ataCasePlural</accept>
    <message>Same suffix on verbs</message>
    <accept lang="wk-LA">bilTensePlural</accept>
</schema>